{
  "prompt": "Tap when the marker hits the gold.",
  "theme": {
    "label": "Pit stop",
    "resultUnit": "seconds"
  },
  "rounds": [
    {
      "zoneStartPct": 58,
      "zoneEndPct": 74,
      "sweepSeconds": 1.6
    },
    {
      "zoneStartPct": 64,
      "zoneEndPct": 76,
      "sweepSeconds": 1.3
    },
    {
      "zoneStartPct": 70,
      "zoneEndPct": 79,
      "sweepSeconds": 1.1
    }
  ],
  "explanation": {
    "correct": "Pit crews win races by shaving tenths. Precision beats speed.",
    "incorrect": "A slow stop can cost track position, which is hard to win back.",
    "sayThisLine": "That pit stop cost him three spots."
  }
}
